<?xml version="1.0" encoding="utf-8"?>
<!DOCTYPE Pip3C3InvoiceNotification SYSTEM "3C3_MS_V01_01_InvoiceNotification.dtd">
<Pip3C3InvoiceNotification>
	<fromRole>
		<PartnerRoleDescription>
			<GlobalPartnerRoleClassificationCode></GlobalPartnerRoleClassificationCode>
			<PartnerDescription>
				<BusinessDescription>
				</BusinessDescription>
			</PartnerDescription>
		</PartnerRoleDescription>
	</fromRole>
	<Invoice>
		<billFrom>
			<PartnerTaxDescription>
				<BusinessDescription>
				</BusinessDescription>
				<GlobalPartnerClassificationCode></GlobalPartnerClassificationCode>
			</PartnerTaxDescription>
		</billFrom>
		<billTo>
			<PartnerTaxDescription>
				<BusinessDescription>
				</BusinessDescription>
				<GlobalPartnerClassificationCode></GlobalPartnerClassificationCode>
			</PartnerTaxDescription>
		</billTo>
		<GlobalDocumentTypeCode></GlobalDocumentTypeCode>
		<InvoiceLineItem>
			<LineNumber></LineNumber>
			<OrderStatus>
				<PurchaseOrder>
					<ProductLineItem>
						<GlobalProductUnitOfMeasureCode></GlobalProductUnitOfMeasureCode>
						<LineNumber></LineNumber>
						<ProductDescription>
							<ProductIdentification>
							</ProductIdentification>
						</ProductDescription>
						<ProductQuantity></ProductQuantity>
						<unitPrice>
							<FinancialAmount>
								<GlobalCurrencyCode></GlobalCurrencyCode>
								<MonetaryAmount></MonetaryAmount>
							</FinancialAmount>
						</unitPrice>
					</ProductLineItem>
				</PurchaseOrder>
			</OrderStatus>
			<totalLineItemAmount>
				<FinancialAmount>
					<GlobalCurrencyCode></GlobalCurrencyCode>
					<MonetaryAmount></MonetaryAmount>
				</FinancialAmount>
			</totalLineItemAmount>
		</InvoiceLineItem>
		<isLockBoxUsed>
			<AffirmationIndicator></AffirmationIndicator>
		</isLockBoxUsed>
		<isRebill>
			<AffirmationIndicator></AffirmationIndicator>
		</isRebill>
		<totalInvoiceAmount>
			<FinancialAmount>
				<GlobalCurrencyCode></GlobalCurrencyCode>
				<MonetaryAmount></MonetaryAmount>
			</FinancialAmount>
		</totalInvoiceAmount>
	</Invoice>
	<thisDocumentGenerationDateTime>
		<DateTimeStamp></DateTimeStamp>
	</thisDocumentGenerationDateTime>
	<thisDocumentIdentifier>
		<ProprietaryDocumentIdentifier></ProprietaryDocumentIdentifier>
	</thisDocumentIdentifier>
	<toRole>
		<PartnerRoleDescription>
			<GlobalPartnerRoleClassificationCode></GlobalPartnerRoleClassificationCode>
			<PartnerDescription>
				<BusinessDescription>
				</BusinessDescription>
			</PartnerDescription>
		</PartnerRoleDescription>
	</toRole>
</Pip3C3InvoiceNotification>
